pmid,title,year,abstract
35361964,Cell cycle regulation: p53-p21-RB signaling,35361964,
35087226,p53 in ferroptosis regulation: the new weapon for the old guardian,35087226,
35971677,p53 Activation Paradoxically Causes Liver Cancer.,35971677,"Activation of p53 regulates a transcriptional program that can cause cell cycle arrest, senescence, apoptosis, and ferroptosis, which are potent tumor suppressive mechanisms. Unexpectedly, Makino and colleagues show in this issue of Cancer Research that the constitutive activation of p53 in murine hepatocytes leads to tumor development. Detailed analyses indicate that p53 activation leads to loss of hepatocytes, increased expression of chemokines and humoral factors, and expansion of the hepatic progenitor cell population. These progenitor cells are highly proliferative, show chromosomal instability, and eventually transform. In chronic liver disease in humans, activation of p53 is associated with increased liver cancer development. This study highlights the complexity and non-cell autonomous nature of the physiologic p53 response. See related article by Makino et al., p. 2860."
36216888,"Drugging p53 in cancer: one protein, many targets",36216888,
35798843,A p53–phosphoinositide signalosome regulates nuclear AKT activation,35798843,
35361963,Mutant p53: it’s not all one and the same,35361963,
35346511,The p53 network: cellular and systemic DNA damage responses in cancer and aging.,35346511,
33785447,The complexity of p53-mediated metabolic regulation in tumor suppression.,33785447,
36681079,Cyclin E-induced replicative stress drives p53-dependent whole-genome duplication,36681079,
35444234,p53 at the crossroad of DNA replication and ribosome biogenesis stress pathways,35444234,
35563397,Therapeutics Targeting p53-MDM2 Interaction to Induce Cancer Cell Death,35563397,"Named as the guardian of the genome, p53 is a tumor suppressor that regulates cell function, often through many different mechanisms such as DNA repair, apoptosis, cell cycle arrest, senescence, metabolism, and autophagy. One of the genes that p53 activates is MDM2, which forms a negative feedback loop since MDM2 induces the degradation of p53. When p53 activity is inhibited, damaged cells do not undergo cell cycle arrest or apoptosis. As 50% of human cancers inactivate p53 by mutation, current research focuses on reactivating p53 by developing drugs that target the p53-MDM2 interaction, which includes the binding of MDM2 and phosphorylation of p53. The objective of this article is to provide a short list and description of p53-MDM2 antagonists that may be excellent candidates for inducing cancer cell death. Relevant articles were searched for and identified using online databases such as PubMed and ScienceDirect. Increasing p53 levels, by targeting the p53-MDM2 interaction, can help p53 play its role as a tumor suppressor and induce cancer cell death. Researchers have identified different compounds that can act as inhibitors, either by directly binding to MDM2 or by modifying p53 with phosphorylation. The results associated with the drugs demonstrate the importance of targeting such interactions to inhibit cancer cell growth, which indicates that the use of the compounds may improve cancer therapeutics."
35390676,SSBP1 drives high fructose-induced glomerular podocyte ferroptosis via activating DNA-PK/p53 pathway,35390676,
35804915,p53 Isoforms as Cancer Biomarkers and Therapeutic Targets,35804915,"Simple Summary The well-known tumor suppressor protein p53 plays important roles in tumor prevention through transcriptional regulation of its target genes. Reactivation of p53 activity has been a potent strategy for cancer treatment. Accumulating evidences indicate that p53 isoforms truncated/modified in the N- or C-terminus can modulate the p53 pathway in a p53-dependent or p53-independent manner. It is thus imperative to characterize the roles of the p53 isoforms in cancer development. This review illustrates how p53 isoforms participate in tumor development and/or suppression. It also summarizes the knowledge about the p53 isoforms as promising cancer biomarkers and therapeutic targets. Abstract This review aims to summarize the implications of the major isoforms of the tumor suppressor protein p53 in aggressive cancer development. The current knowledge of p53 isoforms, their involvement in cell-signaling pathways, and their interactions with other cellular proteins or factors suggests the existence of an intricate molecular network that regulates their oncogenic function. Moreover, existing literature about the involvement of the p53 isoforms in various cancers leads to the proposition of therapeutic solutions by altering the cellular levels of the p53 isoforms. This review thus summarizes how the major p53 isoforms Δ40p53α/β/γ, Δ133p53α/β/γ, and Δ160p53α/β/γ might have clinical relevance in the diagnosis and effective treatments of cancer."
35752743,p53 immunohistochemistry in endometrial cancer: clinical and molecular correlates in the PORTEC-3 trial,35752743,
35831864,Targeting p53–MDM2 interaction by small-molecule inhibitors: learning from MDM2 inhibitors in clinical trials,35831864,
35740352,p53 and Its Isoforms in Renal Cell Carcinoma—Do They Matter?,35740352,"p53 is a transcription al factor responsible for the maintenance of cellular homeostasis. It has been shown that more than 50% of tumors are connected with mutations in the Tp53 gene. These mutations cause a disturbance in cellular response to stress, and eventually, cancer development. Apart from the full-length p53, at least twelve isoforms of p53 have been characterized. They are able to modulate p53 activity under stress conditions. In 2020, almost a half of million people around the world were diagnosed with renal cancer. One genetic disturbance which is linked to the most common type of kidney cancer, renal cell carcinoma, RCC, occurs from mutations in the VHL gene. Recent data has revealed that the VHL protein is needed to fully activate p53. Disturbance of the interplay between p53 and VHL seems to explain the lack of efficient response to chemotherapy in RCC. Moreover, it has been observed that changes in the expression of p53 isoforms are associated with different stages of RCC and overall survival. Thus, herein, an attempt was made to answer the question whether p53 and its isoforms are important factors in the development of RCC on the one hand, and in positive response to anti-RCC therapy on the other hand."
36171607,"p53 amyloid aggregation in cancer: function, mechanism, and therapy",36171607,
36353498,The role of p53 in liver fibrosis,36353498,"The tumor suppressor p53 is the central hub of a molecular network, which controls cell proliferation and death, and also plays an important role in the occurrence and development of liver fibrosis. The abundant post-translational processing and modification endow the functional diversity of p53. Considering the relationship between p53 and liver fibrosis, drug intervention targeting p53 or management of p53 regulation might be effective strategies to treat liver fibrosis. Here, we systematically discuss the regulation of p53 in different liver cells (hepatocytes, immune cells, HSCs, etc) and the role of p53 in the development of liver fibrosis, and propose possible interventions to prevent the pathogenic processes of liver fibrosis."
36638783,p53 engages the cGAS/STING cytosolic DNA sensing pathway for tumor suppression,36638783,"Tumor suppression by p53 is known to involve cell autonomous and non-cell autonomous mechanisms. p53 has been shown to suppress tumor growth by modulating immune system functions, however, the mechanistic basis for this activity is not well understood. Here we report that p53 promotes the degradation of the DNA exonuclease TREX1, resulting in cytosolic dsDNA accumulation. We demonstrate that p53 requires the ubiquitin ligase TRIM24 to induce TREX1 ubiquitin-dependent degradation. The accumulation of cytosolic DNA due to p53’s suppression of TREX1 activates the cytosolic DNA sensor, cGAS and its downstream effectors STING/TBK1/IRF3 resulting in induction of Type I interferons. TREX1 overexpression sufficed to block WTp53 activation of the cGAS/STING pathway. WTp53 mediated induction of type I interferon (IFNB1) response could be suppressed by cGAS/STING knockout. We find that p53’s tumor suppressor activities are compromised by loss of signaling through the cGAS/STING pathway. Thus, our study reveals that p53 utilizes the cGAS/STING innate immune system pathway for both cell intrinsic and cell extrinsic tumor suppressor activities."
36613518,p53 Family in Resistance to Targeted Therapy of Melanoma,36613518,"Metastatic melanoma is one of the most aggressive tumors, with frequent mutations affecting components of the MAPK pathway, mainly protein kinase BRAF. Despite promising initial response to BRAF inhibitors, melanoma progresses due to development of resistance. In addition to frequent reactivation of MAPK or activation of PI3K/AKT signaling pathways, recently, the p53 pathway has been shown to contribute to acquired resistance to targeted MAPK inhibitor therapy. Canonical tumor suppressor p53 is inactivated in melanoma by diverse mechanisms. The TP53 gene and two other family members, TP63 and TP73, encode numerous protein isoforms that exhibit diverse functions during tumorigenesis. The p53 family isoforms can be produced by usage of alternative promoters and/or splicing on the C- and N-terminus. Various p53 family isoforms are expressed in melanoma cell lines and tumor samples, and several of them have already shown to have specific functions in melanoma, affecting proliferation, survival, metastatic potential, invasion, migration, and response to therapy. Of special interest are p53 family isoforms with increased expression and direct involvement in acquired resistance to MAPK inhibitors in melanoma cells, implying that modulating their expression or targeting their functional pathways could be a potential therapeutic strategy to overcome resistance to MAPK inhibitors in melanoma."
35965531,p53 as a biomarker and potential target in gastrointestinal stromal tumors,35965531,"KIT and PDGFRA play a major role in the oncogenic process in gastrointestinal stroma tumors (GIST) and small molecules have been employed with great success to target the KIT and PDGFRA pathways in this cancer. However, approximately 10% of patients with GIST are resistant to current targeted drug therapy. There is a need to explore other potential targets. Although p53 alterations frequently occur in most cancers, studies regarding p53 in GIST have been limited. The CDKN2A/MDM2/p53 axis regulates cell cycle progression and DNA damage responses, which in turn control tumor growth. This axis is the major event required for transformation from low- to high-risk GIST. Generally, p53 mutation is infrequent in GIST, but p53 overexpression has been reported to be associated with high-risk GIST and unfavorable prognosis, implying that p53 should play a critical role in GIST. Also, Wee1 regulates the cell cycle and the antitumor activity of Wee1 inhibition was reported to be p53 mutant dependent. In addition, Wee1 was reported to have potential activity in GIST through the regulation of KIT protein and this mechanism may be dependent on p53 status. In this article, we review previous reports regarding the role of p53 in GIST and propose targeting the p53 pathway as a novel additional treatment strategy for GIST."
35398929,P53 deficiency affects cholesterol esterification to exacerbate hepatocarcinogenesis,35398929,"Background and Aims: Cholesterol ester (CE) biosynthesis and homeostasis play critical roles in many cancers, including HCC, but their exact mechanistic contributions to HCC disease development require further study. Approach and Results: Here, we report on a proposed role of tumor suppressor P53 in its repressing ubiquitin‐specific peptidase 19 (USP19) and sterol O‐acyltransferase (SOAT) 1, which maintains CE homeostasis. USP19 enhances cholesterol esterification and contributes to hepatocarcinogenesis (HCG) by deubiquitinating and stabilizing SOAT1. Loss of either SOAT1 or USP19 dramatically attenuates cholesterol esterification and HCG in P53‐deficient mice fed with either a normal chow diet or a high‐cholesterol, high‐fat diet (HCHFD). SOAT1 inhibitor avasimibe has more inhibitory effect on HCC progression in HCHFD‐maintained P53‐deficient mice when compared to the inhibitors of de novo cholesterol synthesis. Consistent with our findings in the mouse model, the P53‐USP19‐SOAT1 signaling axis is also dysregulated in human HCCs. Conclusions: Collectively, our findings demonstrate that SOAT1 participates in HCG by increasing cholesterol esterification, thus indicating that SOAT1 is a potential biomarker and therapeutic target in P53‐deficient HCC."
35888186,Role of p53 in Regulating Radiation Responses,35888186,"p53 is known as the guardian of the genome and plays various roles in DNA damage and cancer suppression. The p53 gene was found to express multiple p53 splice variants (isoforms) in a physiological, tissue-dependent manner. The various genes that up- and down-regulated p53 are involved in cell viability, senescence, inflammation, and carcinogenesis. Moreover, p53 affects the radioadaptive response. Given that several studies have already been published on p53, this review presents its role in the response to gamma irradiation by interacting with MDM2, NF-κB, and miRNA, as well as in the inflammation processes, senescence, carcinogenesis, and radiation adaptive responses. Finally, the potential of p53 as a biomarker is discussed."
36497084,Insights into Regulators of p53 Acetylation,36497084,"The tumor suppressor p53 is a transcription factor that regulates the expression of dozens of target genes and diverse physiological processes. To precisely regulate the p53 network, p53 undergoes various post-translational modifications and alters the selectivity of target genes. Acetylation plays an essential role in cell fate determination through the activation of p53. Although the acetylation of p53 has been examined, the underlying regulatory mechanisms remain unclear and, thus, have attracted the interest of researchers. We herein discuss the role of acetylation in the p53 pathway, with a focus on p53 acetyltransferases and deacetylases. We also review recent findings on the regulators of these enzymes to understand the mode of p53 acetylation from a broader perspective."
36028493,DAXX-ATRX regulation of p53 chromatin binding and DNA damage response,36028493,
35380358,Hyperactivating p53 in Human Papillomavirus-Driven Cancers: A Potential Therapeutic Intervention,35380358,
36354374,MEX3A Mediates p53 Degradation to Suppress Ferroptosis and Facilitate Ovarian Cancer Tumorigenesis,36354374,"Degradation of p53 mediated by MEX3A drives ovarian cancer growth by circumventing p53 tumor suppressive functions, suggesting targeting MEX3A as a potential strategy for treating of ovarian cancer expressing WT p53."
36291874,GOF Mutant p53 in Cancers: A Therapeutic Challenge,36291874,"Simple Summary In normal cells, p53 is a protein which regulates the cell cycle progression to ensure normal cell division, growth, and development. However, in cancer, changes in the p53 DNA sequence, called genetic mutation, results in the protein either losing its normal function or exhibiting advanced pro-tumorigenic functions that lead to cancer. Importantly, cancers with mutations in the p53 protein often represent ones which are more aggressive and more resistant to chemotherapy. As a result, many studies have and continue to investigate multiple ways to target mutant p53-bearing cancer using targeted therapy, gene therapy, immunotherapy, and combination therapies. Knowledge of these strategies is important in improving the overall therapeutic response of cancers with mutant p53. This review highlights new strategies and discusses the progression of such therapies. Abstract TP53 is mutated in the majority of human cancers. Mutations can lead to loss of p53 expression or expression of mutant versions of the p53 protein. These mutant p53 proteins have oncogenic potential. They can inhibit any remaining WTp53 in a dominant negative manner, or they can acquire new functions that promote tumour growth, invasion, metastasis and chemoresistance. In this review we explore some of the mechanisms that make mutant p53 cells resistant to chemotherapy. As mutant p53 tumours are resistant to many traditional chemotherapies, many have sought to explore new ways of targeting mutant p53 tumours and reinstate chemosensitivity. These approaches include targeting of mutant p53 stability, mutant p53 binding partners and downstream pathways, p53 vaccines, restoration of WTp53 function, and WTp53 gene delivery. The current advances and challenges of these strategies are discussed."
37028271,p53-Dependent ferroptosis pathways in sepsis.,37028271,
36553058,p53 Modulates Radiosensitivity in Head and Neck Cancers—From Classic to Future Horizons,36553058,"p53, initially considered a tumor suppressor, has been the subject of research related to cancer treatment resistance in the last 30 years. The unfavorable response to multimodal therapy and the higher recurrence rate, despite an aggressive approach, make HNSCC a research topic of interest for improving therapeutic outcomes, even if it is only the sixth most common malignancy worldwide. New advances in molecular biology and genetics include the involvement of miRNA in the control of the p53 pathway, the understanding of mechanisms such as gain/loss of function, and the development of different methods to restore p53 function, especially for HPV-negative cases. The different ratio between mutant p53 status in the primary tumor and distant metastasis originating HNSCC may serve to select the best therapeutic target for activating an abscopal effect by radiotherapy as a “booster” of the immune system. P53 may also be a key player in choosing radiotherapy fractionation regimens. Targeting any pathway involving p53, including tumor metabolism, in particular the Warburg effect, could modulate the radiosensitivity and chemo-sensitivity of head and neck cancers."
36678521,Therapeutic Strategies to Activate p53,36678521,"The p53 protein has appropriately been named the “guardian of the genome”. In almost all human cancers, the powerful tumor suppressor function of p53 is compromised by a variety of mechanisms, including mutations with either loss of function or gain of function and inhibition by its negative regulators MDM2 and/or MDMX. We review herein the progress made on different therapeutic strategies for targeting p53."
35487975,Deciphering the acetylation code of p53 in transcription regulation and tumor suppression,35487975,
36232329,Anticancer Therapeutic Strategies Targeting p53 Aggregation,36232329,"p53 is a tumor suppressor protein that is mutated in more than 50% of cancer cases. When mutated, it frequently results in p53 oncogenic gain of function (GOF), resulting in a greater tendency to aggregate in the phase separation and phase transition pathway. GOFs related to p53 aggregation include chemoresistance, which makes therapy even more difficult. The therapies available for the treatment of cancer are still quite limited, so the study of new molecules and therapeutic targets focusing on p53 aggregates is a promising strategy against cancer. In this review, we classify anticancer molecules with antiaggregation properties into four categories: thiol alkylating agents, designed peptides, agents with chaperone-based mechanisms that inhibit p53 aggregation, and miscellaneous compounds with anti-protein aggregation properties that have been studied in neurodegenerative diseases. Furthermore, we highlight autophagy as a possible degradation pathway for aggregated p53. Here, considering cancer as a protein aggregation disease, we review strategies that have been used to disrupt p53 aggregates, leading to cancer regression."
35601652,Association of p53 with Neurodegeneration in Parkinson's Disease,35601652,"p53 is a vital transcriptional protein implicated in regulating diverse cellular processes, including cell cycle arrest, DNA repair, mitochondrial metabolism, redox homeostasis, autophagy, senescence, and apoptosis. Recent studies have revealed that p53 levels and activity are substantially increased in affected neurons in cellular and animal models of Parkinson's disease (PD) as well as in the brains of PD patients. p53 activation in response to neurodegenerative stress is closely associated with the degeneration of dopaminergic neurons accompanied by mitochondrial dysfunction, reactive oxygen species (ROS) production, abnormal protein aggregation, and impairment of autophagy, and these pathogenic events have been implicated in the pathogenesis of PD. Pathogenic p53 integrates diverse cellular stresses and activate these downstream events to induce the degeneration of dopaminergic neurons; thus, it plays a crucial role in the pathogenesis of PD and appears to be a potential target for the treatment of the disease. We reviewed the current knowledge concerning p53-dependent neurodegeneration to better understand the underlying mechanisms and provide possible strategies for PD treatment by targeting p53."
35707366,p53-Mediated Indirect Regulation on Cellular Metabolism: From the Mechanism of Pathogenesis to the Development of Cancer Therapeutics,35707366,"The transcription factor p53 is the most well-characterized tumor suppressor involved in multiple cellular processes, which has expanded to the regulation of metabolism in recent decades. Accumulating evidence reinforces the link between the disturbance of p53-relevant metabolic activities and tumor development. However, a full-fledged understanding of the metabolic roles of p53 and the underlying detailed molecular mechanisms in human normal and cancer cells remain elusive, and persistent endeavor is required to foster the entry of drugs targeting p53 into clinical use. This mini-review summarizes the indirect regulation of cellular metabolism by wild-type p53 as well as mutant p53, in which mechanisms are categorized into three major groups: through modulating downstream transcriptional targets, protein-protein interaction with other transcription factors, and affecting signaling pathways. Indirect mechanisms expand the p53 regulatory networks of cellular metabolism, making p53 a master regulator of metabolism and a key metabolic sensor. Moreover, we provide a brief overview of recent achievements and potential developments in the therapeutic strategies targeting mutant p53, emphasizing synthetic lethal methods targeting mutant p53 with metabolism. Then, we delineate synthetic lethality targeting mutant p53 with its indirect regulation on metabolism, which expands the synthetic lethal networks of mutant p53 and broadens the horizon of developing novel therapeutic strategies for p53 mutated cancers, providing more opportunities for cancer patients with mutant p53. Finally, the limitations and current research gaps in studies of metabolic networks controlled by p53 and challenges of research on p53-mediated indirect regulation on metabolism are further discussed."
35696550,Constitutive Activation of the Tumor Suppressor p53 in Hepatocytes Paradoxically Promotes Non–Cell Autonomous Liver Carcinogenesis,35696550,"This study reveals that activation of p53 in hepatocytes promotes liver carcinogenesis derived from HPCs, which elucidates a paradoxical aspect of a tumor suppressor p53 and novel mechanism of liver carcinogenesis."
35941392,Emerging role of tumor suppressor p53 in acute and chronic kidney diseases,35941392,
36197521,A Small Molecule Reacts with the p53 Somatic Mutant Y220C to Rescue Wild-type Thermal Stability,36197521,An allele-specific covalent small molecule was identified that selectively reacts with the mutant cysteine Y220C of p53 and leads to the rescue of wild-type thermal stability levels.
36183376,A comprehensive study of p53 protein,36183376,"The protein p53 has been extensively investigated since it was found 43 years ago and has become a “guardian of the genome” that regulates the division of cells by preventing the growth of cells and dividing them, that is, inhibits the development of tumors. Initial proof of protein existence by researchers in the mid‐1970s was found by altering and regulating the SV40 big T antigen termed the A protein. Researchers demonstrated how viruses play a role in cancer by employing viruses' ability to create T‐antigens complex with viral tumors, which was discovered in 1979 following a viral analysis and cancer analog research. Researchers later in the year 1989 explained that in Murine Friend, a virus‐caused erythroleukemia, commonly found that p53 was inactivated to suggest that p53 could be a “tumor suppressor gene.” The TP53 gene, encoding p53, is one of human cancer's most frequently altered genes. The protein‐regulated biological functions of all p53s include cell cycles, apoptosis, senescence, metabolism of the DNA, angiogenesis, cell differentiation, and immunological response. We tried to unfold the history of the p53 protein, which was discovered long back in 1979, that is, 43 years of research on p53, and how p53's function has been developed through time in this article."
