pmid,title,year,abstract
36499487,Bromodomain Protein BRD4-Mediated Mutant p53 Transcription Promotes TNBC Progression,36499487,"TP53 is the most common mutated gene in human cancer. Mutant p53 protein loses its tumor-suppressor properties and gains oncogenic activity. Mutant p53 is a therapeutic target in a broad range of cancer types. However, how mutant p53 is epigenetically regulated during tumor progression remains elusive. In this study, we found that the upregulation of mutant p53 is mediated by bromodomain protein BRD4 in triple-negative breast cancer (TNBC) cells. Inhibition of BRD4 with its inhibitor JQ1 or knockdown of BRD4 suppressed the transcription of mutant p53, which led to the re-expression of p21, the inhibition of S-phase entry, and colony formation in TNBC cells. BRD4 also positively regulated the transcription of wild-type p53, whereas JQ1 treatment and knockdown of BRD4 decreased the expression of p21 in MCF-7 cells. Knockdown of BRD4 resulted in attenuation of TNBC tumor growth in vivo. Taken together, our results uncover a novel regulatory mechanism of mutant p53 via BRD4, and suggest that the bromodomain inhibitor suppresses tumorigenesis through targeting mutant p53 in TNBC."
35868560,Hepatic p53 is regulated by transcription factor FOXO1 and acutely controls glycogen homeostasis,35868560,
36714865,Structural basis for p53 binding to its nucleosomal target DNA sequence,36714865,"Abstract The tumor suppressor p53 functions as a pioneer transcription factor that binds a nucleosomal target DNA sequence. However, the mechanism by which p53 binds to its target DNA in the nucleosome remains elusive. Here we report the cryo-electron microscopy structures of the p53 DNA-binding domain and the full-length p53 protein complexed with a nucleosome containing the 20 base-pair target DNA sequence of p53 (p53BS). In the p53-nucleosome structures, the p53 DNA-binding domain forms a tetramer and specifically binds to the p53BS DNA, located near the entry/exit region of the nucleosome. The nucleosomal position of the p53BS DNA is within the genomic p21 promoter region. The p53 binding peels the DNA from the histone surface, and drastically changes the DNA path around the p53BS on the nucleosome. The C-terminal domain of p53 also binds to the DNA around the center and linker DNA regions of the nucleosome, as revealed by hydroxyl radical footprinting. These results provide important structural information for understanding the mechanism by which p53 binds the nucleosome and changes the chromatin structure for gene activation."
36471402,p53 immunostaining pattern is a useful surrogate marker for TP53 gene mutations,36471402,
35977539,Sall4 guides p53-mediated enhancer interference upon DNA damage in mouse embryonic stem cells.,35977539,"p53 plays pivotal roles in maintaining the genomic stability of mouse embryonic stem cells (mESCs) through transcriptionally activating and repressing target genes. However, how p53 recognizes its repressed targets remains largely unknown. Herein, we demonstrate that Sall4 negatively regulates DNA damage induced apoptosis (DIA) of mESCs through mediating p53 recruitment to enhancers of ESC-associated genes repressed by p53 from promoters of p53-activated genes. Upon DNA damage, Sall4 is transcriptionally repressed by p53, and plays an anti-apoptotic role without altering p53 activation. Moreover, Sall4 is identified as a novel p53-interacting partner. Consistently, Sall4 exerts its anti-apoptotic function in a p53-dependent manner. Intriguingly, Sall4 depletion not only promotes the transcriptional activation of several p53-regulated pro-apoptotic genes but also compromises p53-mediated repression of ESC master transcription factors in response to DNA damage. Mechanistically, Sall4 balances p53-binding affinity between p53-activated and -repressed genes through tethering p53 to ESC enhancers. In light of our study, Sall4 may contribute to tumorigenesis by antagonizing p53-mediated apoptosis."
35877475,Decreased DNA Damage and Improved p53 Specificity of RITA Analogs,35877475,"Abstract Reactivation of p53 tumor-suppressor function by small molecules is an attractive strategy to defeat cancer. A potent p53-reactivating molecule RITA, which triggers p53-dependent apoptosis in human tumor cells in vitro and in vivo, exhibits p53-independent cytotoxicity due to modifications by detoxification enzyme Sulfotransferase 1A1 (SULT1A1), producing a reactive carbocation. Several synthetic modifications to RITA's heterocyclic scaffold lead to higher energy barriers for carbocation formation. In this study, we addressed the question whether RITA analogs NSC777196 and NSC782846 can induce p53-dependent apoptosis without SULT1A1-dependent DNA damage. We found that RITA analog NSC782846, but not NSC777196, induced p53-regulated genes, targeted oncogene addiction, and killed cancer cells upon p53 reactivation, but without induction of DNA damage and inhibition RNA pol II. Our results might demonstrate a method for designing more specific and potent RITA analogs to accelerate translation of p53-targeting compounds from laboratory bench to clinic."
35980253,p53 Missense Mutation is Associated with Immune Cell PD-L1 Expression in Triple-Negative Breast Cancer,35980253,"Abstract The programmed death ligand 1 (PD-L1) is a pivotal biomarker of immunotherapy in triple negative breast cancer (TNBC). TP53 is reported as a positive regulatory predictor of immune efficacy. The correlation of p53 expression or mutation and PD-L1 expression is explored. By immunohistochemistry, PD-L1 expression between p53 mutation (missense and nonsense) and wild type; p53 no-expression/loss vs. expression were compared. There was a significant association between p53 mutation, especially missense mutation with higher histological grade, and PD-L1 expression in immune cells (ICs). Both p53 missense mutation and PD-L1 expression may be potential targets for improving immunotherapy response in TNBC."
35367578,p53 mutants G245S and R337H associated with the Li-Fraumeni syndrome regulate distinct metabolic pathways.,35367578,
35596964,The LRRC8C-STING-p53 axis in T cells: A Ca2+ affair.,35596964,
36990132,Variable p53/Nrf2 crosstalk contributes to triptolide-induced hepatotoxic process.,36990132,
35481640,FOXO4 interacts with p53 TAD and CRD and inhibits its binding to DNA,35481640,"Transcription factor p53 protects cells against tumorigenesis when subjected to various cellular stresses. Under these conditions, p53 interacts with transcription factor Forkhead box O (FOXO) 4, thereby inducing cellular senescence by upregulating the transcription of senescence‐associated protein p21. However, the structural details of this interaction remain unclear. Here, we characterize the interaction between p53 and FOXO4 by NMR, chemical cross‐linking, and analytical ultracentrifugation. Our results reveal that the interaction between p53 TAD and the FOXO4 Forkhead domain is essential for the overall stability of the p53:FOXO4 complex. Furthermore, contacts involving the N‐terminal segment of FOXO4, the C‐terminal negative regulatory domain of p53 and the DNA‐binding domains of both proteins stabilize the complex, whose formation blocks p53 binding to DNA but without affecting the DNA‐binding properties of FOXO4. Therefore, our structural findings may help to understand the intertwined functions of p53 and FOXO4 in cellular homeostasis, longevity, and stress response."
35618207,Ser392 phosphorylation modulated a switch between p53 and transcriptional condensates.,35618207,
36230002,Characterization of full-length p53 aggregates and their kinetics of formation.,36230002,
36266286,p53 mutation in normal esophagus promotes multiple stages of carcinogenesis but is constrained by clonal competition,36266286,
36720193,Provocative non-canonical roles of p53 and AKT signaling: A role for Thymosin β4 in medulloblastoma.,36720193,
36106631,Increased p53 expression induced by APR-246 reprograms tumor-associated macrophages to augment immune checkpoint blockade,36106631,"In addition to playing a major role in tumor cell biology, p53 generates a microenvironment that promotes antitumor immune surveillance via tumor-associated macrophages. We examined whether increasing p53 signaling in the tumor microenvironment influences antitumor T cell immunity. Our findings indicate that increased p53 signaling induced either pharmacologically with APR-246 (eprenetapopt) or in p53-overexpressing transgenic mice can disinhibit antitumor T cell immunity and augment the efficacy of immune checkpoint blockade. We demonstrated that increased p53 expression in tumor-associated macrophages induces canonical p53-associated functions such as senescence and activation of a p53-dependent senescence-associated secretory phenotype. This was linked with decreased expression of proteins associated with M2 polarization by tumor-associated macrophages. Our preclinical data led to the development of a clinical trial in patients with solid tumors combining APR-246 with pembrolizumab. Biospecimens from select patients participating in this ongoing trial showed that there was a suppression of M2-polarized myeloid cells and increase in T cell proliferation with therapy in those who responded to the therapy. Our findings, based on both genetic and a small molecule–based pharmacological approach, suggest that increasing p53 expression in tumor-associated macrophages reprograms the tumor microenvironment to augment the response to immune checkpoint blockade."
35961068,Discovery of MDM2-p53 and MDM4-p53 protein-protein interactions small molecule dual inhibitors.,35961068,
36923534,Role of p53 in breast cancer progression: An insight into p53 targeted therapy,36923534,"The transcription factor p53 is an important regulator of a multitude of cellular processes. In the presence of genotoxic stress, p53 is activated to facilitate DNA repair, cell cycle arrest, and apoptosis. In breast cancer, the tumor suppressive activities of p53 are frequently inactivated by either the overexpression of its negative regulator MDM2, or mutation which is present in 30-35% of all breast cancer cases. Notably, the frequency of p53 mutation is highly subtype dependent in breast cancers, with majority of hormone receptor-positive or luminal subtypes retaining the wild-type p53 status while hormone receptor-negative patients predominantly carry p53 mutations with gain-of-function oncogenic activities that contribute to poorer prognosis. Thus, a two-pronged strategy of targeting wild-type and mutant p53 in different subtypes of breast cancer can have clinical relevance. The development of p53-based therapies has rapidly progressed in recent years, and include unique small molecule chemical inhibitors, stapled peptides, PROTACs, as well as several genetic-based approaches using vectors and engineered antibodies. In this review, we highlight the therapeutic strategies that are in pre-clinical and clinical development to overcome p53 inactivation in both wild-type and mutant p53-bearing breast tumors, and discuss their efficacies and limitations in pre-clinical and clinical settings."
37041410,VprBP/DCAF1 regulates p53 function and stability through site-specific phosphorylation.,37041410,
35792674,The Elephant Evolved p53 Isoforms that Escape MDM2-Mediated Repression and Cancer,35792674,"Abstract The p53 tumor suppressor is a transcription factor with roles in cell development, apoptosis, oncogenesis, aging, and homeostasis in response to stresses and infections. p53 is tightly regulated by the MDM2 E3 ubiquitin ligase. The p53–MDM2 pathway has coevolved, with MDM2 remaining largely conserved, whereas the TP53 gene morphed into various isoforms. Studies on prevertebrate ancestral homologs revealed the transition from an environmentally induced mechanism activating p53 to a tightly regulated system involving cell signaling. The evolution of this mechanism depends on structural changes in the interacting protein motifs. Elephants such as Loxodonta africana constitute ideal models to investigate this coevolution as they are large and long-living as well as having 20 copies of TP53 isoformic sequences expressing a variety of BOX-I MDM2-binding motifs. Collectively, these isoforms would enhance sensitivity to cellular stresses, such as DNA damage, presumably accounting for strong cancer defenses and other adaptations favoring healthy aging. Here we investigate the molecular evolution of the p53–MDM2 system by combining in silico modeling and in vitro assays to explore structural and functional aspects of p53 isoforms retaining the MDM2 interaction, whereas forming distinct pools of cell signaling. The methodology used demonstrates, for the first time that in silico docking simulations can be used to explore functional aspects of elephant p53 isoforms. Our observations elucidate structural and mechanistic aspects of p53 regulation, facilitate understanding of complex cell signaling, and suggest testable hypotheses of p53 evolution referencing Peto’s Paradox."
35665610,Identification of mutant p53-specific proteins interaction network using TurboID-based proximity labeling.,35665610,
36499604,Complete Models of p53 Better Inform the Impact of Hotspot Mutations,36499604,"Mutations in tumor suppressor genes often lead to cancerous phenotypes. Current treatments leverage signaling pathways that are often compromised by disease-derived deficiencies in tumor suppressors. P53 falls into this category as genetic mutations lead to physical changes in the protein that impact multiple cellular pathways. Here, we show the first complete structural models of mutated p53 to reveal how hotspot mutations physically deviate from the wild-type protein. We employed a recently determined structure for the p53 monomer to map seven frequent clinical mutations using computational modeling approaches. Results showed that missense mutations often changed the conformational structure of p53 in the DNA-binding site along with its electrostatic surface charges. We posit these changes may amplify the toxic effects of these hotspot mutations by destabilizing an important zinc ion coordination region in p53 to impede proper DNA interactions. These results highlight the imperative need for new studies on patient-derived proteins that may assist in redesigning structure-informed targeted therapies."
37065475,The regulatory effects of p53 on the typical and atypical ferroptosis in the pathogenesis of osteosarcoma: A systematic review,37065475,"Study background: As a rare condition, osteosarcoma affects approximately 3% of all cancer patients. Its exact pathogenesis remains largely unclear. The role of p53 in up- and down-regulating atypical and typical ferroptosis in osteosarcoma remains unclear. The primary objective of the present study is investigating the role of p53 in regulating typical and atypical ferroptosis in osteosarcoma. Methods: The Preferred Reporting Items for Systematic Reviews and Meta-Analysis (PRISMA) and the Patient, Intervention, Comparison, Outcome, and Studies (PICOS) protocol were used in the initial search. The literature search was performed in six electronic databases, including EMBASE, Cochrane library of trials, Web of Science, PubMed, Google Scholar, and Scopus Review, using keywords connected by Boolean operators. We focused on studies that adequately defined patient profiles described by PICOS. Results and discussion: We found that p53 played fundamental up- and down-regulatory roles in typical and atypical ferroptosis, resulting in either advancement or suppression of tumorigenesis, respectively. Direct and indirect activation or inactivation of p53 downregulated its regulatory roles in ferroptosis in osteosarcoma. Enhanced tumorigenesis was attributed to the expression of genes associated with osteosarcoma development. Modulation of target genes and protein interactions, especially SLC7A11, resulted in enhanced tumorigenesis. Conclusion: Typical and atypical ferroptosis in osteosarcoma were regulatory functions of p53. The activation of MDM2 inactivated p53, leading to the downregulation of atypical ferroptosis, whereas activation of p53 upregulated typical ferroptosis. Further studies should be performed on the regulatory roles of p53 to unmask its possible clinical applications in the management of osteosarcoma."
36549455,Interaction of C-terminal p53 isoforms depends strongly upon DNA sequence and topology.,36549455,
36134028,A p53 transcriptional signature in primary and metastatic cancers derived using machine learning,36134028,"The tumor suppressor gene, TP53, has the highest rate of mutation among all genes in human cancer. This transcription factor plays an essential role in the regulation of many cellular processes. Mutations in TP53 result in loss of wild-type p53 function in a dominant negative manner. Although TP53 is a well-studied gene, the transcriptome modifications caused by the mutations in this gene have not yet been explored in a pan-cancer study using both primary and metastatic samples. In this work, we used a random forest model to stratify tumor samples based on TP53 mutational status and detected a p53 transcriptional signature. We hypothesize that the existence of this transcriptional signature is due to the loss of wild-type p53 function and is universal across primary and metastatic tumors as well as different tumor types. Additionally, we showed that the algorithm successfully detected this signature in samples with apparent silent mutations that affect correct mRNA splicing. Furthermore, we observed that most of the highly ranked genes contributing to the classification extracted from the random forest have known associations with p53 within the literature. We suggest that other genes found in this list including GPSM2, OR4N2, CTSL2, SPERT, and RPE65 protein coding genes have yet undiscovered linkages to p53 function. Our analysis of time on different therapies also revealed that this signature is more effective than the recorded TP53 status in detecting patients who can benefit from platinum therapies and taxanes. Our findings delineate a p53 transcriptional signature, expand the knowledge of p53 biology and further identify genes important in p53 related pathways."
36172677,"Alterations in p53 Influence hTERT, VEGF and MMPs Expression in Oral Cancer Patients",36172677,"Background: Mutant p53 is the crucial molecule in the etiopathogenesis of oral cancer. Therefore, we aimed to evaluate the impact of alterations of the p53 gene and its negative feedback regulator, MDM2, on the expression of hTERT, VEGF, and MMPs; the critical genes involved in oral cancer progression. Material and methods: p53 and MDM2 genotyping were done by PCR-RFLP. p53 mutation analysis was performed using PCR-SSCP and sequencing. hTERT, VEGFA isoforms, MMP2, and MMP9 mRNA levels were analyzed by semi-quantitative Reverse Transcriptase PCR. Results: Arg allele at p53 exon 4 was significantly associated with overexpression of hTERT, MMP2, and MMP9 individually. Expression of hTERT, VEGF A isoforms, MMP2 and MMP9 were significantly altered in the presence of p53 and MDM2 polymorphisms and p53 mutations in a specific combination. Mutant p53, Arg allele at p53 exon 4 locus, and G/G/or T/T genotype at MDM2revealed increased expression of hTERT, VEGF A isoforms, and MMP2/9. Conclusion: This study provides evidence that apart from mutant p53, naturally occurring sequence variants in p53codon 72 (Arg72Pro) (rs1042522) and MDM2 (rs2279744) significantly alter the expression of hTERT, VEGF-A isoforms, and MMP2/9 in a specific combination. The differential interaction of codon 72 variants with MDM2, hTERT, VEGF-A isoforms and MMP2/9 play a role in the aggressiveness of oral cancer. The results have important implications for oral cancer progression and should be explored for innovative treatment options."
36961913,Genetic modifiers of p53: opportunities for breast cancer therapies,36961913,"Each day our cells encounter a wide range of genomic damage and the p53 protein arbitrates decisions of cell cycle arrest to allow repair of DNA or promote elimination of cells with malignant potential through apoptosis. The prevalence of TP53 mutations in nearly all tumors emphasizes its role as a formidable barrier that must be breached to allow oncogenic transformation. Inherited mutations in TP53 are also the primary genetic lesions found in Li-Fraumeni Syndrome (LFS), a familial cancer predisposition characterized by tumors in many tissues [1, 2]. However, tissues are not all equally vulnerable to disruptions in p53 function. Among women with inherited mutations in TP53, breast cancer is by far the most common tumor (Figure 1) [3]. Somatic mutations in TP53 are also prevalent in sporadic breast cancers, especially in the triple-negative subtype [4]. The proportion rises to nearly 50% of breast cancers that exhibit impaired function of the p53 pathway based on gene expression signatures as a surrogate biomarker of p53 activity [5–7]. Therefore, the breast epithelium appears to be uniquely sensitive to alterations in p53 function. The pattern of cancer-associated mutations in TP53 is distinct among tumor suppressor genes as missense mutations are the most common. Missense mutations are distributed throughout p53 leaving the protein-coding region intact but its function altered. This pattern is also found in women with inherited mutations in TP53 who develop breast cancers (Figure 2) [8]. Missense mutations affecting codons R175, G245, R248 and R273 within the DNA binding domain account for 26% of the total and have been associated with dominant-negative activities. The majority of the remaining 37% of missense mutations exhibit partial or complete loss of function based on transactivation criteria [8]. Nonsense, frameshift, splice mutations and deletions make up the remaining 31% and also cause loss of function in most cases. Thus, the mutational spectrum is similar to that found in other"
35689249,"Prognostic value of p16, p53, and pcna in sarcoma and an evaluation of immune infiltration",35689249,
35639868,Correlation of gemcitabine sensitization by Chk1 inhibition with p53 status.,35639868,"AbstractsChk1 inhibition can selectively improve gemcitabine sensitivity in p53-deficient cells by checkpoints abrogation throughout the cell cycle. However, the dependency of p53 status is still controversial for predicting the priority of such synergy. This study aimed at expounding the differential therapeutic properties of gemcitabine sensitization by Chk1 inhibition potentially affected by p53 status. We introduced wild-type and hotspot mutant p53 in p53-null H1299 cells, and quantified combination of gemcitabine with two Chk1 inhibitors using Chou-Talalay method. As a result, depletion of p53 preferentially produced synergistic effects. Wild-type and mutant p53 also conferred drug synergy but gradually showed compromised potency of growth inhibition. These data provide increased evidence that p53 status is a weak predictor for identifying an effective synergy, but genetic loss of p53 is relatively favorable for combination treatment. Further efforts on validation in more cell lines and clinical models could improve the predictive validity in this study."
35635656,Complementary omics strategies to dissect p53 signaling networks under nutrient stress,35635656,
36419936,p53-dependent c-Fos expression is a marker but not executor for motor neuron death in spinal muscular atrophy mouse models,36419936,"The activation of the p53 pathway has been associated with neuronal degeneration in different neurological disorders, including spinal muscular atrophy (SMA) where aberrant expression of p53 drives selective death of motor neurons destined to degenerate. Since direct p53 inhibition is an unsound therapeutic approach due carcinogenic effects, we investigated the expression of the cell death-associated p53 downstream targets c-fos, perp and fas in vulnerable motor neurons of SMA mice. Fluorescence in situ hybridization (FISH) of SMA motor neurons revealed c-fos RNA as a promising candidate. Accordingly, we identified p53-dependent nuclear upregulation of c-Fos protein in degenerating motor neurons from the severe SMNΔ7 and intermediate Smn2B/– SMA mouse models. Although motor neuron-specific c-fos genetic deletion in SMA mice did not improve motor neuron survival or motor behavior, p53-dependent c-Fos upregulation marks vulnerable motor neurons in different mouse models. Thus, nuclear c-Fos accumulation may serve as a readout for therapeutic approaches targeting neuronal death in SMA and possibly other p53-dependent neurodegenerative diseases."
